Bharathiraja Speciality Hospital Blood Bank,Tamil Nadu,CHENNAI,"20 Gopathi Narayanaswami Chetty Road, Thiyagaraya Nagar
Parthasarathy Puram, T.Nagar Chennai",600017,9443478202,,http://www.brhospital.in,Private,NO,13.048082,80.245055
Global Hospitals Blood Bank (A unit of Rabindranath GE Medical Association Pvt Ltd,Tamil Nadu,CHENNAI,"439, Cheran Nagar, Perumbakkam
Cheran Nagar, Perumbakkam
Chennai",600100,N/A,deepti.vij@gmail.com,,Private,YES,12.898506,80.206289
Sri Ramachandra Medical College and Research Institute Blood Bank,Tamil Nadu,CHENNAI,"No.1, Ramachandra Nagar, Porur, Chennai",600116,N/A,srmcbb@yahoo.com,http://www.sriramachandra.com,Private,YES,13.038833,80.143534
Rotary Blood Bank,Tamil Nadu,CHENNAI,"Medavakkam Main Rd, Vanuvampet, Madipakkam, Chennai",600091,N/A,rotarybloodbank_ngl@yahoo.com,,Charity,YES,12.98107,80.195475
St Thomas Blood Bank and Research Centre St Thomas Hospital,Tamil Nadu,CHENNAI,"5/105, II floor Defence Colony Road, St. Thomas Mount",16,N/A,stthomasbloodbankcrc@gmail.com,,Charity,YES,13.012134,80.19625
Right Hospitals Blood Bank,Tamil Nadu,CHENNAI,"No.1, Professor Subramaniam Street, Kilpauk",600010,N/A,rightbloodbank@gmail.com,http://www.rightbloodbank@gmail.com,Private,YES,13.078914,80.240581
Apollo Hospitals Blood Bank,Tamil Nadu,CHENNAI,"Run by Apollo Hospitals Educational Trust, No. 64, Fourth Floor, Vanagaram to Ambattur Main Road, Ayanambakkam",600095,N/A,bloodbank_aybkm@apollohospitals.com,http://www.chennai.apollohospitals.com,Charity,YES,13.071266,80.150603
Landsteiner Lakshmi Memorial Research Foundation,Tamil Nadu,CHENNAI,"14/90, Ground Floor, First Floor and Second Floor, Ayyavoo Street, Aminijikarai",600029,8012999900,llmrf@yahoo.com / landsteinercharities@gmail.com,http://www.llmrfbloodbank.com,Charity,YES,13.079435,80.257308
Madras Egmore Lions Blood Bank and Research Foundation,Tamil Nadu,CHENNAI,"Egmore Lions Blood Bank and Research Foundation, 130 Marshall Road, Egmore
Chennai",600008,8012999900,ceo@lionsbloodbank.net,,Charity,YES,13.069705,80.260797
Government Royapettah Hospital Blood Bank,Tamil Nadu,CHENNAI,"No 1, Westcott Road, Royapettah, Chennai, Tamil Nadu ",600014,9940030580,bloodbankgrh@gmail.com,,Government,NO,13.054709,80.265073
Government Peripheral Hospital Blood Bank,Tamil Nadu,CHENNAI,"Government Peripheral Hospital 
M-2, Third Avenue,  Anna Nagar
(Near K-4 Police Station)
Chennai",600102,9551107853,bbmogphan@gmail.com,,Government,NO,13.095428,80.219317
Government Kasthurbai Gandhi Hospital for Women & Children,Tamil Nadu,CHENNAI,"Victoria Hostel Rd, Triplicane, Chennai, Tamil Nadu",600005,9444955617,kghbloodbank@gmail.com,,Government,NO,13.059296,80.278431
Institute of Obstetrics and Gynaecology Government Hospital for Women and Children,Tamil Nadu,CHENNAI,"Police Commisioners Rd, Egmore, Chennai, Tamil Nadu",600008,9941823003,iogwch@yahoo.com,,Government,NO,13.073689,80.259207
Government RSRM Hospital,Tamil Nadu,CHENNAI,"Cemetery Road, Royapuram, Chennai, Tamil Nadu ",600013,9840570494,rsrmbloodbank@gmail.com,,Government,NO,13.108993,80.288403
Chennai Port Trust Hospital Blood Bank,Tamil Nadu,CHENNAI,"No.10 Spring Heaven Road, George Town, Chennai, Tamil Nadu",600001,,,http://www.chennaiport.gov.in/,Charity,NO,13.085925,80.291757
ESI Hospital Blood Bank,Tamil Nadu,CHENNAI,"The Blood Bank Medical Officer, ESI Hospital, Ayanavaram
Chennai",600023,9443285809,bloodbankesihospital@gmail.com,,Government,NO,13.094828,80.240417
Rotary Central TTK Voluntary Health Services (Dr Raganathan Memorial Blood Bank),Tamil Nadu,CHENNAI,"Tharamani, Adyar, Chennai, Tamil Nadu",600113,9444021560,vhsbb@yahoo.com,,Charity,YES,13.002059,80.24716
 AA Lab Blood Bank,Tamil Nadu,CHENNAI,"Old No 12 New No 23, 5th Cross Street, Nungambakkam
Nungambakkam
Chennai, Tamil Nadu",600034,"09444368721, 09884067846",,,Charity,YES,13.054067,80.239828
Sree Venkateswara Blood Bank,Tamil Nadu,CHENNAI,"158, Mannarswamy Kovil Street
Royapuram
Chennai, Tamil Nadu",600013,"09841067775, 09786631490",drkselvarajan@yahoo.co.in,,Private,NO,13.109828,80.281945
CSI Rainy Multi Speciality Hospital,Tamil Nadu,CHENNAI,"45, GA Road, Old Washermanpet, Chennai, Tamil Nadu ",600021,,,http://www.csirainyhospital.com,Private,NO,13.11812,80.290511
Dhanvandri Blood Bank and Research Centre of Sreemahalakshmi Charitable Health Trust,Tamil Nadu,CHENNAI,"F-1, 52A, T.Nagar, S W Boag Rd,CIT Nagar, Chennai, Tamil Nadu",600017,N/A,siva_ramank@yahoo.co.in,,Charity,YES,13.031013,80.231629
ACS General Hospital ,Tamil Nadu,CHENNAI,"Run by Dr MGR Educational Reaserch Institute, Poonamalle High Road, Chennai- Bangalore Highway NH4, Velappanchava
Chennai, Tamil Nadu ",600077,,,http://www.acsmch.ac.in,Private,NO,13.06852,80.131421
Muthukumaran Medical College Hospital and Research Institute,Tamil Nadu,CHENNAI,"Chikkarayapuram, Chennai, Tamil Nadu",600069,N/A,drramarao4@yahoo.com,,Private,YES,13.017931,80.108969
Tagore Medical College Hospital Blood Bank,Tamil Nadu,CHENNAI,"Vandalur - Kelambakkam Road, Melakkottaiyur Post, Near Vandalur, Rathinamangalam, Chennai, Tamil Nadu",600127,"9551757371, 9443704267",pathology@tagoremch.com,http://www.tagoremch.com,Private,YES,12.860204,80.291655
Fortis Malar Hospitals Limited Blood Bank,Tamil Nadu,CHENNAI,"52, First Main Road, Gandhi Nagar, Adyar",600020,9176633665,bloodbank.malar@fortishealthcare.com,http://www.fortismalar.com/,Private,YES,13.01006,80.258702
Madha Medical College and Hospital Blood Bank,Tamil Nadu,CHENNAI,"State Highway 113,Thandalam,Kovur, Harijana Colony
Chennai, Tamil Nadu",600128,8148077777,,http://www.madhagroups.org,Private,NO,13.004678,80.112061
Billroth Hospitals Limited Blood Bank,Tamil Nadu,CHENNAI,"No.56 & 57, New Door No,5& AMP:7 Gajapathy Street, Shenoy Nagar, Chennai",600030,9840538108,bloodbank1@billrothhospital.com,http://www.billrothhospitals.com,Private,YES,13.075671,80.227297
Government Stanley Hospital Blood Bank,Tamil Nadu,CHENNAI,"305 OSH Rd, Royapuram, Chennai, Tamil Nadu",600001,9840053283,N/A,http://www.stanleymedicalcollege.ac.in/,Government,YES,13.105854,80.285439
M/S SRM Institutes For Medical Science,Tamil Nadu,CHENNAI," No.1 Block B, First Floor
Jawaharlal Nehru Salai, ( 100 feet road) 
Vadapalani",600026,,transfusionmedicine@simshospitals.com,,Private,YES,0,0
Government Kasturba Gandhi Hospital Blood Bank,Tamil Nadu,CHENNAI,Chennai,600008,,,,Government,,0,0
Sree Balaji General Hospital Blood Bank,Tamil Nadu,CHENNAI,"7, Works Road, Chrompet,Chennai",600044,N/A,,http://www.sbmch.ac.in,Private,NO,12.954308,80.137703
Indian Red Cross Society Blood Bank,Tamil Nadu,CHENNAI,"Tamil Nadu Branch, No, 50 Montieth Road,Egmore",600008,"09443076418, 08754040286, 09444441898",,,Charity,,0,0
The Tamil Nadu Dr. MGR Medical University Blood Bank,Tamil Nadu,CHENNAI,"69, Anna Salai, Guindy,Chennai",600032,,,http://www.tnmgrmu.ac.com,Government,YES,13.009896,80.218188
ESI Hospital Blood Bank,Tamil Nadu,COIMBATORE,"ESI Hospital, Kamarajar Road, Uppilipalayam, Varadharajapuram(P.O)",641015,9788172927,ictcesicbe@gmail.com,,Government,NO,11.009114,77.023704
Coimbatore Medical College Hospital Blood Bank,Tamil Nadu,COIMBATORE,"Trichy Road, Kallimadu, Coimbatore",641018,9843193801,bloodbankcmch@gmail.com,http://www.cmccbe.ac.in/,Government,YES,10.994861,76.969577
KG Hospital Blood Bank,Tamil Nadu,COIMBATORE,"5, Government Arts College Road, Coimbatore",641018,9486499369,,,Charity,YES,11.000435,76.971556
PSG Hospital Blood Bank,Tamil Nadu,COIMBATORE,"Avinashi Road, Kalluri Nagar, Peelamedu, PSG Medical College And Hospital Campus, Coimbatore",641004,N/A,pathology@psgimsr.ac.in,http://www.psghospitals.com,Charity,YES,11.018766,77.007145
G. Kuppusamy Naidu Memorial Hospital Blood Bank,Tamil Nadu,COIMBATORE,"P.B. No. 6327, Nethaji Road, Pappanaickenpalayam
Coimbatore",641037,093455 02499,bloodbank@gknmh.org,http://www.gknmhospital.org,Private,YES,11.01277,76.980509
Ramakrishna Hospital Blood Bank,Tamil Nadu,COIMBATORE," No. 395 Sarojini Naidu Road , New Siddhapudur, Coimbatore ",641044,8870157558,docraj66@gmail.com,http://www.sriramakrishnahospital.com,Charity,YES,11.023686,76.976713
Ramana Gounder Medical Trust Hospital Blood Bank,Tamil Nadu,COIMBATORE,"Mettupalayam Road, S. F. No. 47 and 48 Thudaiyalur ",34,N/A,bloodbank@rgmt.org,,Charity,YES,11.07054,76.942457
Ganga Hospital Blood Bank,Tamil Nadu,COIMBATORE,"No. 313, Mettupalayam Road, Saibaba Koil, Coimbatore ",641043,N/A,gangabloodbank@yahoo.in,,Private,YES,11.025162,76.952501
Kongu Nadu Hospital Private Limited Blood Bank,Tamil Nadu,COIMBATORE,"336 to 353 Dr. Rajendra Prasad Road, (100 feet Road) 11th St, Tatabad, Coimbatore",641012,N/A,,,Private,,11.018134,76.960595
Lions Club of Coimbatore Legend Blood Bank Research Centre,Tamil Nadu,COIMBATORE,"Red Rase Tower No.422 DB Road, R.S. Puram",641002,N/A,cbe_lionsbloodbank@yahoo.co.in,,Charity,YES,11.005808,76.951074
Shanthi Social Services Medical Centre Blood Bank,Tamil Nadu,COIMBATORE,"Neelikonampalayam, Coimbatore ",641005,9629297329,bloodbank@shanthisocialservice.org,,Private,YES,11.003734,77.038048
 Kuriji Hospital Blood Bank (A Unit of Vangal Amman Health Service Limited),Tamil Nadu,COIMBATORE,"522/3, Udayampalayam Road, Sowripalayam Post",641028,9629297329,kurinjihospital@gmail.com,,Private,NO,11.019604,76.994964
Sree Abirami Hospital Private Limited Blood Bank,Tamil Nadu,COIMBATORE,"No. 33, Madukkarai Road, Sundarapuram, Coimbatore",641024,N/A,abiramihospital@gmail.com,,Private,YES,10.952537,76.973216
Government Hospital Blood Bank,Tamil Nadu,COIMBATORE," Ooty main road, Mettupalayam, Coimbatore",641301,098437 06590,bloodbankghmtp@gmail.com,,Government,NO,11.304849,76.937118
Sheela Hospitals Blood Bank,Tamil Nadu,COIMBATORE,"No. 117, East Power House road, Tatabad,Coimbatore",641012,094435 51497,sheelahospital@gmail.com,http://www.sheelahospital.in,Private,NO,11.018303,76.960319
Kovai Medical Centre and Hospital Blood Bank,Tamil Nadu,COIMBATORE,"3209 Avinashi Road, Sitra, Coimbatore",641014,"097897 28148, 09843017817",drchinsarun@gmail.com,http://www.kmchhospitals.com,Private,YES,11.042085,77.040324
IMA Rotary Midtown Mahaveer Blood Bank,Tamil Nadu,COIMBATORE," 92, Syrian Church Road, RS Puram, Coimbatore  ",641001,097879 69099,imabloodbankcbe@gmail.com,http://www.ima-india.org,Private,YES,11.005732,76.960893
The Coimbatore Bio Medical Services Blood Bank,Tamil Nadu,COIMBATORE,"No.190A, Bashyakarlu Road East, R.S. Puram",641002,097913 60516,poornashloka@yahoo.com,,Charity,NO,11.014581,76.953349
Karpagam Hospital Blood Bank,Tamil Nadu,COIMBATORE,"Pollachi Main Road, Othakkalmandapam, Coimbatore",641032,N/A,karpagamhospital@gmail.com,http://www.karpagam.ac.in,Charity,YES,10.885007,77.008223
Swaasam Blood Bank (Run by Any time Blood Voluntary Association),Tamil Nadu,COIMBATORE,"Shop No. 9/3, Sakthi estate, M. G Road, Avarampalayam
Coimbatore",641006,"099425 44454, 09942344454",swasmbloodbank@gmail.com,http://www.anytimebloodvoluntaryorganization.org,Charity,NO,11.024262,76.984656
RVS Hospital Blood Bank,Tamil Nadu,COIMBATORE,"242-B, Trichy Rd,Mathiyalagan Nagar,Sulur,  ",641402,,,,Private,NO,11.028425,77.134135
Government Hospital Blood Bank,Tamil Nadu,COIMBATORE,"Government Hospital, NH209,Mahalingapuram,Udumalpet Road,Pollachi",642001,9865305136,cmopollachi@gmail.com,,Government,NO,10.658046,77.009584
Pollachi Blood Bank Services,Tamil Nadu,COIMBATORE,"No : 6, Kanitha methai Ramaujam Street, Venkatesa Colony, Pollachi",642001,98430181803,willpharma_india@yahoo.com,,Private,NO,10.665479,77.007079
Rajah Muthiah Medical College and Hospital Blood Bank,Tamil Nadu,CUDDALORE,"Annamalai Nagar, Chidambaram",608202,9944669799,pathormmcau2014@gmail.com,,Private,YES,11.398477,79.718821
Kamaraj Government Hospital Blood Bank,Tamil Nadu,CUDDALORE,"S.P.Kovil Street, Chidamabaram bus stand, Chidambaram",638001,0 9842381535,bloodbankcdm@gmail.com,,Government,NO,11.394771,79.699614
Hi Tech Blood Bank and Research Foundation,Tamil Nadu,CUDDALORE,"No. 2, Chinnappa Mudali Street Manja Kuppam",1,N/A,hitechbloodbank2003@gmail.com,,Private,NO,0,0
Government Hospital Blood Bank,Tamil Nadu,CUDDALORE,"Government  Hospital, Viruduchalam (T.K)",606001,9688034114,vdmbloodbank@gmail.com,,Government,NO,11.515577,79.316767
Government Head Quarters Hospital Blood Bank,Tamil Nadu,CUDDALORE,"Nellikuppam road, Cuddalore",607001,9443253439,cuddalorebloodbank@gmail.com ,,Government,NO,11.756684,79.759266
Blood Donor Association Blood Bank,Tamil Nadu,CUDDALORE,"No. 17A, Hospital Road , Cuddalore",607001,"09367612970, 09360633822",,,Private,NO,0,0
Neyveli Lignite Corporation,Tamil Nadu,CUDDALORE,"NH532, M.K Colony, Neyveli, Tamil Nadu",607802,9791557028,nlcghbloodbank@gmail.com,http://www.nlcindia.com,Government,NO,11.537043,79.467181
Dharmapuri Medical College Hospital Blood Bank,Tamil Nadu,DHARMAPURI,"3/29A, Nethaji Bye Pass Road, Kamalakhsmi Colony
Dharmapuri",636701,9443166388,bloodbankdpi@gmail.com,,Government,NO,12.122192,78.156738
Ashok Blood Bank and Clinical Laboratory,Tamil Nadu,DHARMAPURI,"No. 63A, Sengodipuram Road IInd Floor, Dharmapuri",636702,9843260627,ashok123.ak@gmail.com,,Private,NO,12.132581,78.161182
Om Sakthi Blood Bank,Tamil Nadu,DHARMAPURI,"No 4 Sengodipuram, Dharmapuri",636701,93456102799,omsakthihospital@gmail.com,,Private,NO,12.132676,78.161652
Christian Community Health Center and Hospital Blood Bank,Tamil Nadu,DINDIGUL,"Shanthipuram, Ambilikkai, Tamil Nadu ",624612,8940487508,pbjacobcherian@gmail.com,,Charity,NO,10.545977,77.725236
St.Joseph Hospital Blood Bank,Tamil Nadu,DINDIGUL,"Chennai Theni Highway, Nehruji Nagar",624001,9942018383,N/A,,Private,NO,10.370257,77.980644
Indian Blood Bank,Tamil Nadu,DINDIGUL,"2/2 Spencor&#39;s Compound
",20,N/A,djegadesh78@gmail.com,,Private,NO,0,0
Dindigul Blood Bank,Tamil Nadu,DINDIGUL,"No. 28/2, Veppan thoppu street, Palani Road, Dindigul",624001,9443177063,dglbloodbank99@gmail.com,,Private,YES,10.366656,77.977708
Government Head quarters Hospital Blood Bank,Tamil Nadu,DINDIGUL,"Trichy Road,New bus stand, Opp to North police station
",624001,9443447160,bloodbankdindigul@gmail.com,,Government,NO,10.363893,77.976364
Leonard Hospital Blood Bank,Tamil Nadu,DINDIGUL,"SH 155, Arunachalapuram, Batlagundu",624202,099442 60622,holyleonard@gmail.com,,Charity,NO,10.165505,77.760672
Palani Blood Bank (Run by Annai Educational Trust),Tamil Nadu,DINDIGUL,"49, Dindigal Road, 1st Floor, Opposite to Government  Hospital, Dindigul",624601,"09150181501, 09842925501",palanibloodbank@gmail.com,,Charity,NO,0,0
Kasturba Hospital Blood Bank,Tamil Nadu,DINDIGUL,Gandhigram,624302,N/A,,,Charity,NO,0,0
Christian Fellowship Hospital Blood Bank,Tamil Nadu,DINDIGUL,"Dindigul Main Road, Oddanchathram",624619,9994892496,cfh@sancharnet.in,http://www.cfhospital.com,Charity,NO,10.48803,77.751707
Government Hospital Blood Bank,Tamil Nadu,DINDIGUL,"Dindigul Road, South Anna Nagar, Palani",624601,093446 60502,bloodbankghpalani@gmail.com,,Government,NO,10.448498,77.516908
Erode Blood Bank and Clinical Laboratory,Tamil Nadu,ERODE,"No. 43, Patel Road, 1st Floor,Erode",638001,9841011418,N/A,,Private,YES,11.336191,77.718506
Kongu Blood Bank,Tamil Nadu,ERODE,"TS No. 51/1E Ist floor, Perundurai Road",638011,N/A,,,Private,,11.340634,77.715943
Lotus Blood Bank,Tamil Nadu,ERODE,(Lotus Apollo Hospital) Poonthurai Main Road,638002,N/A,drusha@gmail.com,,Private,NO,11.326009,77.730096
Lions Club of Erode Supreme Charitable Trust Blood Bank,Tamil Nadu,ERODE,"No. 27 S.K.C Road, Erode ",638001,9443931711,lionsbberd@gmail.com,,Charity,YES,0,0
Dhanvantri Charitable Trust Blood Bank,Tamil Nadu,ERODE,"No.1. Old Post office Road, Sathyamangalam",638001,N/A,,,Charity,,0,0
IRT Perunthurai Medical College Hospital Blood Bank,Tamil Nadu,ERODE,"Perundurai, Erode ",638053,N/A,N/A,http://www.irtpmc.ac.in,Government,NO,11.280826,77.567496
Idayam Hospitals Erode Limited Blood Bank,Tamil Nadu,ERODE,"No.15, Palaniappa Street",638009,9842849575,,,Private,NO,0,0
Sri Saanthi Blood Bank (Run by Kaveri trust),Tamil Nadu,ERODE,"6-9, kandappa Lane, Brough Road, Erode",638001,,,,Charity,,0,0
Government Head quarters Hospital Blood Bank Erode,Tamil Nadu,ERODE,Erode,,,,,Government,,0,0
Government Hospital Blood Bank,Tamil Nadu,ERODE,"Government Hospital, Gobichettipalayam",638452,"09842367605, 09442120800",bbghgobi@gmail.com,,Government,NO,11.456457,77.428786
Sri Ram Blood Bank,Tamil Nadu,ERODE,"4/28, Govt Hospital Road, Gobichettipalayam, ",638452,9443014094,sreramdc@gmail.com,,Private,NO,11.455893,77.42957
Chengalpattu Medical College Hospital Blood Bank,Tamil Nadu,KANCHIPURAM,"Anna Nagar, Chengalpattu",603001,9445142097,bbcmchcpt@gmail.com,,Government,YES,12.677617,79.98029
Shri Sathya Sai Medical College and Research Institute Blood Bank,Tamil Nadu,KANCHIPURAM,"Tiruporur - Guduvancherry Main Road, Ammapettai, Chengalpat",603108,9842139353,sathyasais@yahoo.in,,Private,YES,12.746312,80.132393
Essar Blood Bank,Tamil Nadu,KANCHIPURAM,"Arumbakkam Sri AS rajagopalan trust,  No 16. alagesan Road, Vedachalam Nagar",,,,,Private,,0,0
"Military Hospital Blood Bank, St. Thomas Mount",Tamil Nadu,KANCHIPURAM,"Defence Colony 1st Ave,Ekkatuthangal, Chennai",600016,9840362852,,,Government,YES,13.024872,80.199193
Meenakshi Medical College Hospital and Research Institute Blood Bank,Tamil Nadu,KANCHIPURAM,"Enathur, Karrapettai Post, Kanchipuram",631552,N/A,"mmchri@gmail.com, bbmmchri@gmail.com",http://www.mmchri.res.in,Private,YES,12.872611,79.723864
Government Aringnar Anna Memorial Cancer Hospital Blood Bank,Tamil Nadu,KANCHIPURAM," Bangalore High Road, Karaipettai",631552,8220328529,bloodbankkanchipuram@gmail.com,,Government,NO,12.86981,79.715799
Government Head Quarters Hospital Blood Bank,Tamil Nadu,KANCHIPURAM,"Hospital Road, Kanchipuram",631501,8220328529,bloodbankkanchipuram@gmail.com,,Government,NO,12.832978,79.710277
Annai Medical College and Hospital Blood Bank (Run by Sri Devi Karumari Amman Educational Trust),Tamil Nadu,KANCHIPURAM,"1st Floor Casuality Block, Dr. G. Jayarama Nagar, Pennatur, Sri Perumbudur Taluk",602117,1800 121 3010,,http://www.annaiimedicalcollege.com,Charity,NO,12.97068,79.976376
SRM Medical College Hospital Blood Bank,Tamil Nadu,KANCHIPURAM,"SRM Nagar, Potheri, Kattankulathur, Kancheepuram",603203,N/A,N/A,http://www.srmuniv.ac.in,Private,YES,12.822849,80.048734
Chettinad Hospital and Research Institute Blood Bank,Tamil Nadu,KANCHIPURAM,"SH 121, Rajiv Gandhi Salai, Kelambakkam ",603103,9443025241,,http://www.chettinadhospitals.com,Private,YES,12.794973,80.216129
Madurantakam Government Hospital Blood Bank,Tamil Nadu,KANCHIPURAM,"Hospital Road, Madurantakam",603306,"09841419802, 09952523743",ghmadhurantagam@gmail.com,,Government,NO,12.50908,79.890064
Karpaga Vinayaga Institute of Medical Sciences Blood Bank,Tamil Nadu,KANCHIPURAM,"GST Road, Chinna Kolambakkam, Palayanoor P.O.
Madurantagam Taluk.
",603308,N/A,,http://www.kids.edu.in/,Private,,12.592392,79.911956
Government Hospital Tambaram Blood Bank,Tamil Nadu,KANCHIPURAM,"Government Hospital Tambaram, GST Road, Chrompet",600044,9444084885,bloodbanktambram@gmail.com,,Government,NO,12.9456,80.134345
Saveetha Medical College and Hospital Blood Bank (A unit of Saveetha Institute of Medical and Technical Sciences,Tamil Nadu,KANCHIPURAM,"S.No. 302/1, Mavalur kuppam Village, Saveetha Nagar, Thandalam",602105,9842247997,,http://www.saveetha.com,Private,,0,0
Deen Dayal Hospital Blood Bank,Tamil Nadu,KANCHIPURAM,"No. 61, Deen Dayal Nagar, Kunnavalam Post, Tirupati Road,Thiruvallur Taluk,Tamil Nadu ",631210,,,,Private,NO,13.177496,79.810762
M/s Marthandam Blood Bank,Tamil Nadu,Kanyakumari,"2/64, AIFB Hospital Building, Junction Main Road, Marthandam",,,,,Private,,0,0
Sree Mookambika Institute Medical Science Blood Bank,Tamil Nadu,Kanyakumari,"14-9C 15, Ist Floor, Medical College Hospital Building, Padanilam, Kulasekaram",629161,094433 77601,,http://www.sreemookambikainstitute.com,Private,YES,8.361102,77.292365
Government Head Quarters Hospital Blood Bank,Tamil Nadu,Kanyakumari,"Padmanabhapuram, Thuckalay, Kanyakumari",629175,8012503145,N/A,,Government,NO,8.247696,77.313237
"M/S Indian Medical Centre, Dr Kumarsawamy Health Center",Tamil Nadu,Kanyakumari,"Perumal Puram, Kottaram Post",629703,,,,Private,,0,0
Catherine Booth Hospital Blood Bank (Run By The Salvation Army),Tamil Nadu,Kanyakumari,"M/s.  The Salvation Army Catherine Booth Hospital
Arunachalam Colony, Nagercoil",629001,9443374501,oesolomon@gmail.com,,Private,NO,8.200027,77.43068
Kanyakumari Medical College Hospital Blood Bank,Tamil Nadu,Kanyakumari,"KGMCH,  Asaripallam",629003,"07598853127, 08012722728",bbkgmch@gmail.com,http://www.kkmc.ac.in,Government,YES,8.172512,77.392704
AV Rajan Blood Transfusion Services Clinical and Research Laboratories,Tamil Nadu,Kanyakumari,"No. 20/6-75 PWD Road, Rajappa Campus, Chettikulam, Nagercoil",629012,9944669799,,,Private,NO,0,0
Royal Blood Bank  (Run by Royal Medical Trust),Tamil Nadu,Kanyakumari,"No. 40/2 197 PWD Office Road, Peria Nadar Street, Nagerkoil",629001,,,,Charity,NO,0,0
Kanya Blood Bank,Tamil Nadu,Kanyakumari,"No.173 A/1, K.P. Road, Ramavarmapuram, Nagercoil",629 001,9443360716,kanyablood@rediffmail.com,,Private,NO,8.17554,77.429731
Vivek Blood Bank,Tamil Nadu,Kanyakumari," 253, K-11,  K.P. Road, Nagercoil",629003,N/A,viveklaboratories@gmail.com,,Private,YES,8.184559,77.410413
Dr. Jeyasekharan Medical Trust and Nursing Home Blood Bank,Tamil Nadu,Kanyakumari,"No. 253, KP Road, Nagercoil, Kanyakumari, ",629003,N/A,jeyasekhranmedicaltrust@gmail.com,http://www.jeyasekharanhospital.com,Charity,YES,8.184416,77.409869
Thangam Blood Bank (Run by Thangam Chartiable Community Health Trust) William Hospital,Tamil Nadu,Kanyakumari,"No 252, II floor, william hospital complex, Krishnan Koil, Nagerkoil",629003,9442711334,N/A,,Charity,NO,8.191431,77.423288
Bensam Hospital Blood Bank,Tamil Nadu,Kanyakumari,"Kalliancaud, NH 66, Nagercoil",629003,094431 35977 ,bensamhospital2008@gmail.com,http://www.ebeneshbensam.com,Private,NO,8.189676,77.412207
Lords Blood Bank (Run By Rajamony Memorial Educational Charitable Trust),Tamil Nadu,Kanyakumari,"129, Main Road, Opposite to R.C. Church",629003,9894476132,lordsonkannan@gmail.com,,Charity,NO,0,0
Siventhi Blood Bank (Siventhi Medical Trust),Tamil Nadu,Kanyakumari,"1/1  344 -A, M.S. Road,  Nagarkovil",629003,9894216218,,,Charity,NO,0,0
Kanyakumari Medical Mission CSI Hospital Blood Bank,Tamil Nadu,Kanyakumari,"CSI Hospital, SH 180,Neyyoor",629802,,,,Charity,NO,8.211518,77.302952
Karur Blood Bank,Tamil Nadu,KARUR,"No. 196/29, Kamarajapuram",639002,N/A,jwilliamskbbjw@yahoo.com,,Private,YES,10.963696,78.069084
Government Head Quarters Hospital Blood Bank,Tamil Nadu,KARUR,"Government Headquarters Hospital, Karur",639001,"09751323125, 09751097848",karurgh@gmail.com,,Government,NO,10.962277,78.080228
M/S. Rainbow Blood Bank ( Run by rainbow Health &Educational Trust) ,Tamil Nadu,KARUR,"40 car street, Karur",639001,,,,Charity,,0,0
M/s Karur Voluntary Blood Bank and Laboratary,Tamil Nadu,KARUR,20 Kamachi Amman Koil Street,639001,,,,Charity,,0,0
M/S TCR Blood Bank ( Run by TCR hospital & Charitable Trust),Tamil Nadu,KRISHNAGIRI,"TCR Multi Speciality Hospital, No.1/450, Avvai Nagar,Near LIC, Krishnagiri.",635001,9585843555,tcrblood@gmail.com,http://www.tcrmultispecialityhospital.com,Charity,NO,12.5186,78.2137
Government Hospital Blood Bank,Tamil Nadu,KRISHNAGIRI,"SH 17, Denkanikotta Road, Hosur
",635109,"099768 58388, 09443244005",ictchosur@gmail.com,,Government,NO,12.72911,77.825456
Arogya Blood Bank (A Unit of Arogya Seva Hospitals Private Limited),Tamil Nadu,KRISHNAGIRI,"35 Opposite CSI church , Denkanikottai road
New Temple Land Hudco, Shanthi Nagar East, Hosur",635109,N/A,bloodbank.hosur@kauveryhospital.com,,Private,NO,12.728397,77.824389
Life Care Voluntary Blood Bank (Run by Life Care Trust),Tamil Nadu,KRISHNAGIRI,"Venus Arcade, No.2, Ground Floor and First Floor, Old Telephone Exchange Road, Near Parimalam School, Hosur",635109,8123533773,hosurlifecarebloodbank@gmail.com,,Charity,YES,0,0
Government Head Quarters Hospital Blood Bank,Tamil Nadu,KRISHNAGIRI,"Gandhi Road, Old pet, Krishnagiri",635001,"08807273816, 09444708946",krishnagiribs53@yahoo.in,,Government,NO,12.524837,78.220022
Karunya Hospital Blood Bank,Tamil Nadu,KRISHNAGIRI,"No.46,  Ist Cross Co-Operative Colony",635001,9842802199,N/A,,Private,NO,0,0
Government Rajaji Hospital Blood Bank,Tamil Nadu,MADURAI,"Government Rajaji Hospital, Madurai",625002,9786426203,maduraighs5@gmail.com,http://www.madurai.tn.nic.in/gh.html,Government,YES,9.926986,78.131758
Meenakshi Mission Hospital and Research Centre Blood Bank,Tamil Nadu,MADURAI,"Lake Area, Melur Road, Madurai, Tamil Nadu ",625107,9894734003,info@mmhrc.in,http://www.mmhrc.in,Private,YES,9.947597,78.162318
Thai Moogambigai Blood Bank and Clinical Laboratory,Tamil Nadu,MADURAI,"No. 3 Ground Floor (Northern Side),  Javahar Cross Street,  Gandhi Nagar",625020,N/A,N/A,,Private,NO,0,0
The Apollo Speciality Hospital Blood Bank,Tamil Nadu,MADURAI,"No.14 Deputy Collectors Colony, Lake View Road, K.K. Nagar, Madurai",625020,,,http://www.apollohospitals.com,Private,YES,9.927966,78.148775
Vadamalayan Hospital Blood Bank,Tamil Nadu,MADURAI,"Vadamalayan Hospital, No.9B, PT Rajan Road, Chokkikulam, Reserve Police Line",625002,,bloodbank@vadamalayan.org,http://www.vadamalayan.org,Private,YES,9.942846,78.130616
Sivan Blood Bank Run by Lakshmiammal Memorial Trust,Tamil Nadu,MADURAI,"Plot No.10, D.No. 58A Kuruvikaran Salai, 1st Cross Street, Aringnar Anna Nagar",625020,9865199411,sivanbloodbank@yahoo.com,http://www.sivanbloodbank.com,Charity,YES,9.923292,78.140268
Velammal Medical College Hospital and Reserach Institute Blood Bank,Tamil Nadu,MADURAI,"Velammal Village, Madurai-Tuticorin Ring Road, Anuppanadi
Madurai",625009,N/A,vmchbb@gmail.com,http://www.velammalmedicalcollege.com,Private,YES,9.887094,78.150868
Satyam Blood Bank,Tamil Nadu,MADURAI,No. 21C Old Kuyavar Palayam Road ,625009,"09842165654, 09943906500",N/A,,Private,NO,0,0
