Saint George&#39,s Hospital & Regional  Blood Bank,Maharashtra,Mumbai,"Saint George&#39;s Hospital, Behind General Post Office
P. D&#39;Mello Road, Fort, Mumbai","022 22621420, 022 22620242 (Extn.1431)  ",022 22624464 ,,MD (Pathalogy),Government,Applied for renewal,18.94027,72.837319
Tata Memorial Hospital Blood Bank,Maharashtra,MUMBAI,"5th Floor, Service Block, Dr. E. Borges Road, Parel, Mumbai ",400012,9820340073,,http://www.tmc.gov.in,Government,YES,19.004856,72.842945
The B.D. Petit Parsee General Hospital Blood Bank,Maharashtra,MUMBAI,"B.Petit Road, Cumballa Hill,  Mumbai",400036,9323570506,,,Charity,YES,18.968704,72.805743
V. N. Desai Municipal General Hospital Blood Bank,Maharashtra,MUMBAI,"T. P. S. II, 11th Road, Santacruz (E) Mumbai",400055,9820618132,,,Government,NO,31-12-2017,19.078822,72.844994
West Coast Blood Bank,Maharashtra,MUMBAI,"Basement 101, Moon Building, 798, Mori Road, Mahim(W), Mumbai",400016,9820721197,westcoastbloodbank@gmail.com,,Private,YES,19.042954,72.84073
M/s. Balasaheb Thackerey Blood Bank,Maharashtra,MUMBAI,Mumbai,,,,,Private,,0,0
M/s. Pallavi Blood Bank,Maharashtra,MUMBAI,Mumbai,,,,,Private,,0,0
"ESI-PGIMSR, MGM Hospital Blood Bank",Maharashtra,MUMBAI,Mumbai,,,,,Government,,0,0
M/s Sion Blood Bank,Maharashtra,MUMBAI,Mumbai,,,,,Private,,0,0
Harkisandas  Marottamdas Hospital Blood Bank,Maharashtra,MUMBAI,Mumbai,,,,,Private,,0,0
Government Medical College Blood Bank Nagpur,Maharashtra,NAGPUR,"Model Blood Bank, 2nd Floor, Hospital Building, Government Medical College & Hospital, Nagpur  ",440003,9822941695,gmchbbngp@gmail.com,,Government,YES,21.126097,79.097101
Super Speciality Hospital and Medical Post Graduate Institute Blood Bank,Maharashtra,NAGPUR,"Maenad Road, Near RST Cancer Hospital, Nagpur",440003,8275531628,,,Government,NO,21.123952,79.102367
Indira Gandhi Medical College and Hospital Blood Bank,Maharashtra,NAGPUR,"IGMC Hospital, Central Avenue Road, Nagpur ",440018,7709884278,igmc@rediffmail.com,,Government,YES,21.153917,79.092894
Daga Memorial Women Government Hospital Blood Bank,Maharashtra,NAGPUR,"Gandhibag, Nagpur",440002,9422762492,msdaga_WomenHosp@redifmail.com,,Government,NO,21.151511,79.105434
Central India Institute of Haematology & Oncology&#39,s Blood & Blood Component Bank and Apheresis Unit,Maharashtra,Nagpur,"Plot No-14/2, Park Corner, Bal Raj Marg, Near Loma Square, Dhantoli, Nagpur","0712 2430038 , 0712 2428972 , 0712 6464198",,,"MBBS, MD, DCH",Private,2/9/2015,21.134731,79.080223
Jeevan Jyoti Blood Bank and Component,Maharashtra,NAGPUR,"J P Chamber, Madhav Nagar, Dakshin Ambakshari Road  Nagpur",440010,9422113811,jjbb21@hotmail.com,,Charity,YES,21.123051,79.057149
Dr. Hegdewar Blood Bank,Maharashtra,NAGPUR,"2, Sitaram Smruti, West High Court Road, Laxmibhuvan Square, Audumbar Apartment, Dharmpeth, Nagpur ",440010,9922407171,hbbnagpur687@gmail.com,,Charity,YES,21.140579,79.060505
Sainath Blood Bank,Maharashtra,NAGPUR,"531,Jaiswal Building, Above R.K. Traders, Old shukrawari Road, Sakkardara Nagpur",440024,9422502066,sainathbloodbank@gmail.com,,Charity,YES,21.134294,79.076369
Ayush Blood Bank and component Lab,Maharashtra,NAGPUR,"9th Floor, A wing, 901-905, 910-912, Lokmat Building, Nagpur",440010,9823051508,ayush_bbc@rediffmail.com,,Charity,YES,21.135231,79.072978
Lifeline Blood Bank Components and Apherisis Centre Blood Bank,Maharashtra,NAGPUR,"Neeti Gaurav complex , 2nd Floor, Central Bazar Road, Lokmat Square, Ramdaspeth, Nagpur ",400010,9552556425,drwarbhe@gmail.com,httpS://www.lifeline.com,Charity,YES,21.138999,79.063093
Rainbow Blood Bank,Maharashtra,NAGPUR,"3rd Floor, 282, Rainbow Diagnostic Services Central Bazar Road, Ramdas Peth, Nagpur",440010,9975844830,rainbowbloodbank.nagpur@gmail.com,,Charity,YES,21.133584,79.072736
"NKP Salve Institute of Medical Science and Research Center (Lata Mangeshkar Hospital), Blood Bank",Maharashtra,NAGPUR,"5, YMCA Complex, Digdoh Hills, Hingna Road, Nagpur",440019,9850448905,,,Charity,YES,21.144346,79.078848
Nandkishor Education Society Trust - Arpan Voluntary Blood Bank,Maharashtra,NAGPUR,Nagpur,,,,,Charity,,0,0
Dr. Shankarrao Chavan Government Medical College and Guru Govindsinghji Memorial Hospital Blood Bank,Maharashtra,NANDED,"Vazirabad, Nanded ",,"09890172702, 09503007847, 09860127959",gmcbbnanded@gmail.com,,Government,YES,19.109305,77.29295
Indian Red Cross Society Blood Bank,Maharashtra,NANDED,"Parsi Anjuman Complex, Vazirabad, Nanded      ",431602,9850947545,ircsnanded@gmail.com,,Charity,YES,17.399811,78.485456
Golvalkar Guruji Blood Bank,Maharashtra,NANDED,"Plot No.2-12-407, Bandhaghat Road, Vazirabad, Nanded",431601,9822589088,,,Charity,,19.168646,77.326553
Arpan Blood Bank,Maharashtra,NANDED,"2nd Floor, Dayma Complex, Doctor Lane, Ghamodia,Nanded",431601,9881907646,,,Charity,,19.161084,77.303022
Guru Gobindsinghji Blood Bank,Maharashtra,NANDED,"Geeta Bhavan 1 & 2 Floor, House No 3-1-366, Near Government, Opposite to Ayurvedic College, Bus Stand Road, Vazirabad, Nanded          ",431601,9145432520,ggbloodbank@gmail.com,,Charity,YES,19.156029,77.309
Nanded Blood Bank,Maharashtra,NANDED,"Shivaji Nagar ,Opposite to Adhar Hospital, Nanded ",431602,9422382810,nandedbloodbank@gmail.com,,Charity,YES,19.161264,77.304543
Hazur Saheb Blood Bank,Maharashtra,NANDED,"2nd Floor, Opposite to Bank of India, Sant Kripa Market, GG Road, Nanded ",431601,"09689100000, 09960596860",shs.bloodbanknanded@gmail.com,,Charity,YES,19.153093,77.318654
Civil Surgeon - District General Hospital Blood Bank,Maharashtra,NANDURBAR,"Nandurbar, Railway Station Road Survey No.406, Civil Hospital Compound,  Sakri Road, Near Collector Office Nandurbar  ",425412,"09860408109, 09422238791","rmochndb@gmail.com, dponandurbar@mahasacs.org",,Government,NO,21.33867,74.234768
Sahada Blood Bank - Shree Swami  Samartha Vaidyakiya  Shaikshanik and Sanshodhan Sanstha ,Maharashtra,NANDURBAR,"C/o. 1st Floor, Shushrut Hospital, Khetiya Road, Survey 
No. 67/3, Plot No. 3, Sahada, Nandurbar",425409,9371855918,bb_shahada@yahoo.com,,Charity,NO,21.554798,74.472874
Jankalyan Rakta Pedhi,Maharashtra,NANDURBAR,"Nandurbar,1st Floor, Vivekanand Hospital, Desaipura, Nandurbar ",425412,9096175855,jankalyanbbndb@gmail.com ,,Charity,NO,21.36433536,74.24463853
Malegaon Blood Bank,Maharashtra,NASHIK,"2nd Floor, West End Complex, Satana Naka, Malegaon ",423203,9371550550,"malegaonb@gmail.com, ",,Charity,YES,20.55474,74.524396
Seva Blood Bank,Maharashtra,NASHIK,"Nilkanth Building, Satana Naka, Satana Road, Malegaon, Nashik",423203,"09823967555, 08805611555",sevabloodbankmalegaon@gmail.com,,Charity,YES,20.552689,74.516643
Roachabai Sugnomal Manwani - Cantonment General Hospital Blood Bank,Maharashtra,NASHIK,"Vadner Road, Devlali, Nashik",422401,"09850536784, 09404803045, 09420746965             ",,,Government,,19.903354,73.825824
Metro Blood Bank - District (Civil) Hospital Nashik,Maharashtra,NASHIK,"District - Civil Hospital Blood Bank, Near Thakkar Bazaar,  Trimbak Naka, Nashik",422001,9850536784,"civilbloodbanknsk@gmail.com, ",,Government,YES,19.996886,73.778198
Sainik Aspatal Military Hospital Blood Bank,Maharashtra,NASHIK,"Sainik Aspatal, Military Hospital, Deolali",,9545355252,,,Government,,19.9483203,73.841866
Ansar Blood Bank,Maharashtra,NASHIK,"1398/1, Islampura, Industrial Society Compound, Quidwai Road, Malegaon, Nasik",423203,9890353737,,,Charity,NO,20.552043,74.532641
Arpan Blood Bank and Blood Component Laboratory and Research Centre,Maharashtra,NASHIK,"1st Floor, Office No.102/103, Dr. Athawale Chambers, Opposite to Gavkari Press Tilak Path, Nashik 
",422001,"09822324340, 09422770765",,,Charity,YES,20.004874,73.787164
Jankalyan Blood Bank,Maharashtra,NASHIK,"3, Shree Nagar, Old Gangapur Naka, Gangapur Road, Nashik
",422013,9823114809,rssjan_nsk@rediffmail.com,,Charity,YES,20.008838,73.7702
NDMVPS Medical College and Hospital Blood Bank,Maharashtra,NASHIK,At Post Adgaon Dist Nashik ,,9422237694,,,Charity,YES,20.037363,73.852998
Samta Blood Bank,Maharashtra,NASHIK,"F-1, 1st Floor Suyojit Comercial Complex, Mumbai Agra Highway, Below Data Mastics, Mumbai Naka, Nashik 
",422001,9975997867,samtabloodbank@gmail.com,,Charity,YES,19.984791,73.782607
Sanjeevani Blood Bank,Maharashtra,NASHIK,"Nashik, Krushna-Chaya Bangla, Plot No. 10/11, Kurdukar Nagar, Behind Fame Theatre, Nashik Pune Road, Nashik ",422006,"09730733888, 09370355501",,,Charity,,19.975586,73.803963
Jijau Mahila Sevabhavi Sansthan Nashik Blood Bank and Transfusion Research institute Blood Bank,Maharashtra,NASHIK,"Ishwar Krupa Ganesh Nagar, Tidke Colony, Nashik ",,9890609318,,,Charity,,19.990656,73.775241
The Santajee Educational and Medical foundation Trust - Jeevan  Blood Bank ,Maharashtra,NASHIK,"Suyojit City Center, G-11, 12, 13, S. No. 567/1/1 & 567/1/3 (CTS No. 7249 & FP No. 60) Mumbai Naka, Near Mahamarg Bus Stand, Nashik 
",,,,,Charity,YES,19.987781,73.784138
SMBT Institute of Medical Science and Research Centre - Blood Bank and Component,Maharashtra,NASHIK,"SMBT Institute of Medical Science & Research Centre, Blood Bank & Component,  Block-101, Ground Floor, A Wing, New SMBT Hospital Building, Survey No. 470, Nandihills Appt., At Post-Dhamangaon, Ghoti, Igatpuri, Nashik
",422002,9011067101,,,Charity,YES,19.76062,73.769851
Hindustan Aeronautics Limited Blood Bank,Maharashtra,NASHIK,"HAL, Aircraft Division, HAL, In Front of GES HAL High School, Ojhar Township, Niphad, Nashik
",,9420592940,,,Government,NO,20.105897,73.931932
J.D.C. Bytco Hospital Blood Bank,Maharashtra,NASHIK,"1st Floor, Bytco Hospital, Nashik Road, Behind Durga Garden, Shahu Path, Nashik",422101,,,,Government,NO,19.949132,73.838742
Regional Referal Hospital Blood Bank,Maharashtra,NASHIK,"Medical Superintendent, Regional Referal Hospital (Superspeciality Hospital) Blood Bank, Nashik",,,,,Government,,0,0
Shri Krishna Blood Bank,Maharashtra,OSMANABAD,"Dr. Patange Hospital Building, Ajay Nagar Omerga, Omerga,  Osmanabad  ",413606,9422069904,dr.dbpatange@yahoo.com,,Charity,YES,17.83503,76.622149
"Civil Surgeon, General Hospital Blood Bank",Maharashtra,OSMANABAD,"Civil Hospital Osmanabad, Tqand, Osmanabad ",413501,,"bloodbankosmanabad@gmail.com, cs_osmanabad1@rediffmail.com",,Government,YES,18.18077,76.034735
Civil Surgeon - District General Hospital Blood Bank,Maharashtra,PARBHANI,"Blood Bank Civil Surgeon, District General Hospital Blood Bank, Subhash Road, Parbhani
",414001,9422176541,bloodbankghp@gmail.com,,Government,YES,19.271699,76.765032
Kanthak Sevabhavi Sanstha - New Life Blood  Bank,Maharashtra,PARBHANI,"Plot No 22, Survey No 389 and 394, Beside Gurudwara, Station Road, Parbhani ",431401,"09823093235, 09822642102",newlifebloodbank@gmail.com,,Charity,YES,19.273124,76.782625
Indian Red Cross Society Blood Bank,Maharashtra,PUNE,"Indian Red Cross Society (IRCS), (Late Manikbai Chandulal Saraf) Blood Bank, Near Government Silver Jubilee Hospital, Patas Road, Baramati, Pune",413102,9850033891,ircsbbbaramati@gmail.com,,Charity,YES,18.152597,74.574996
Pune Chest and General Hospital Blood Bank,Maharashtra,PUNE,"Aundh Cest Hospital, Aundh Camp, Pune",411027,"09422780176, 09604871471",,,Government,NO,18.575032,73.80537
Sasoon Sarvopchar Hospital Blood Bank,Maharashtra,PUNE,"Ground Floor, Section 5, Opposite to Central Medical Stores, Station Road, Pune",411021,9423575986,bjmc.bloodbank@gmail.com,http://www.sasoonhospitalpune,Government,YES,18.515846,73.858714
Armed Forces Blood Bank,Maharashtra,PUNE,"Vanwadi Armed Force Medical College, Pune",411040,"09850269248, 09545641023",,,Government,YES,18.505159,73.889694
Jankalyan Raktapedhi Pune,Maharashtra,PUNE,"1003, Shukrawar Peth, Swargate - Saras Baugh Road, Near Natraj Hotel, Pune",411002,"09423066622 , 07350002460",janrakta@gmail.com,http://www.janakalyanbloodbank.org,Charity,YES,18.50092,73.857531
Inlaks Budharani Hospital Blood Bank,Maharashtra,PUNE,"7-9, Koregaon Park, Pune",411001,9373510112,,,Charity,YES,18.534391,73.887409
Indian Serological Institute Blood Bank,Maharashtra,PUNE,"21, Anand Baugh, Navi Peth, Near Vaikunth, Pune",411030,"09096039023 , 9096040549 ,9673399497",isibloodbank@rediffmail.com,,Charity,YES,18.506291,73.84264
Acharya Anandrushiji Blood Bank,Maharashtra,PUNE,"191-192, New Sadashiv Peth, S. M. Joshi Foundation Building, Near Patrakar Bhavan, Pune",411030,"09764184192, 09822077702",,,Charity,YES,18.508647,73.844846
Akshay Blood Bank,Maharashtra,PUNE,"Survey No.10/1/3, Unnati Nagar, Bantar High School, Hadapsar, Pune",411028,9890244339,akshaybloodbankpune@gmail.com,,Charity,YES,18.47143,73.959674
Garware Blood Bank - Talegaon Rural Hospital,Maharashtra,PUNE,"Talegaon Dhabhade, Maval, Pune ",410507,"09422080758,   08087000000,  08087099051",,,Charity,YES,18.735319,73.675984
Jehangir Hospital Blood Bank,Maharashtra,PUNE,"32, Sasoon Road, Pune ",411001,8888821087,bloodbank@jehangirhospital.com,http://jehangirhospital.com/,Charity,YES,18.530392,73.876808
KEM Hospital Blood Bank,Maharashtra,PUNE,"Sardar Moodliar Road, Rastha Peth, Pune",411001,,,,Charity,YES,18.519784,73.866906
Grant Medical Foundation A.H. Wadia Trust Blood Bank,Maharashtra,PUNE,"40, Sassoon Road, Ruby Hall Clinic, Post Box No. 70, Pune",411001,9890148566,,,Charity,YES,18.533369,73.876939
Bharati Vidyapeeth Medical Foundation Blood Bank,Maharashtra,PUNE,"Sector - 28, Dhankawadi, Pune Satara Road, Pune",411043,9420320999,,,Charity,YES,18.459914,73.855994
Padmashree Dr. D.Y. Patil (Vishweshwar) Blood Bank,Maharashtra,PUNE,"Padmashree, Dr. D. Y. Patil Medical College Hospital, Sant Tukaram Nagar, Pimpari, Pune",411018,9561792418,,,Charity,YES,18.624175,73.82126
Deenanath Mangeshkar Hospital Blood Bank,Maharashtra,PUNE,"Erandawane, Near Mhatre Bridge, Pune",411004,9822545665,,,Charity,YES,18.502108,73.832232
Poona Serological Institute Blood Bank,Maharashtra,PUNE,"C.T.S. No. 592, 3rd Floor, Dhanwantari Complex, Rasta Peth, Pune",411011,"09822252965, 09822252965",,,Charity,YES,18.516656,73.866532
Sahiyadari Speciality Hospital Blood Bank,Maharashtra,PUNE,"Kokoan Mitra Mandal Medical Port Trust&#39;s Sahiyadari Speciality Hospital Blood Bank, Plot No-30 C, Erandvane, Karve Road, Pune ",411004,9850540682,,,Charity,YES,18.513091,73.839308
Aditya Birla Memorial Hospital Blood Bank,Maharashtra,PUNE,"Survey No:31, Near Morya Mangal Karyalay, Thergaon, Chinchwad, Pune ",411033,9011352331,,,Charity,YES,18.625716,73.774775
Rakesh Jain Memorial Blood Bank,Maharashtra,PUNE,"Poona Hospital and Reserch Centre 27, Sadashiv Peth, Pune  ",411030,9689947454,,,Charity,YES,18.510752,73.842158
Noble Hospital Blood Bank,Maharashtra,PUNE,"B-007, Basement C/o. Noble Hospital, 153 Magarpatta City Road, Hadapsar, Pune  ",411013,9423581029,"skrcorporate@yahoo.co.uk, noblebloodbank@yahoo.in",,Charity,YES,18.505035,73.927256
Smt Kashibai Navale General Hospital Blood Bank,Maharashtra,PUNE,"Sr. No. 50/15 building NO.5 2nd Floor, Narhe, Ambegaon, Pune  ",411041,9370146779,,,Charity,YES,18.45624,73.822183
Pimpari Serological Institute Blood Bank,Maharashtra,PUNE,"Esteem Tower, opposite K.S.B. Pump, Pune-Mumbai Highway, Kharalwadi, Pimpari ",411018,9.22550781198226E+019,psibbpimpri@gmail.com,,Charity,YES,18.624322,73.807929
Chakan Blood Bank,Maharashtra,PUNE,"Sr. No. 4976/1/2 Gate No. 2401, Yashwantnagar Ambethan Road. A/P Chakan, Khed, Pune ",410501,9822524260,,,Charity,YES,18.762296,73.860866
R.G Gholap Memorial Blood Bank,Maharashtra,PUNE,"Office No. 301, 3rd Floor Ashoka Centre, S. No - 47/14, Satara Road, Parvati, Pune",411009,9822442140,gholapbloodbank@gmail.com,,Charity,YES,18.487158,73.857098
Kranti Mitra Mandal Charitable Trust Blood Bank,Maharashtra,PUNE,"1st Floor PMT Buiding Gadital, Hadapsar, Pune ",411028,9960771438,,,Charity,YES,18.501083,73.939062
Krantiveer Chapekar Bandhu Blood Bank,Maharashtra,PUNE,"Pimpri Chinchwad Mahanagar Palika Talera Hospital, Tanaji Nagar Chinchwad, Pune  ",411033,9922501583,,,Charity,YES,18.625689,73.784672
The New Century Medical & Education Foundation Trust - NCORD Blood Bank & Aphaeresis Centre,Maharashtra,PUNE,"NCORD Blood Bank and Aphaeresis centre, S. No. 241/2/1, Geet Ganga Building, Medipoint Hospital Lane, Baner, Pune",411007,9822502812,,,Charity,YES,18.56475,73.800994
Ekta Apang Vikas Sanstha Blood Bank,Maharashtra,PUNE,"Office No. 17/18/19, 1st Floor, Sunshree Woods Commercial Complex, NIBM, Kondhwa, Haveli, Pune",411028,9822009268,,,Charity,YES,18.477273,73.90302
Chattrapati Shahu Maharaj Pratisthan,Maharashtra,PUNE,"S.No. 30, 4th floor, office no. 41, 402, 403, and 5th floor off 502, waris Heights, Pune-Satara Road, Dhankwadi, Pune",411030,9890927792,,,Charity,YES,18.466519,73.857679
Chattrapati Shahu Maharaj Pratisthan Blood Bank,Maharashtra,PUNE,"S. No. 30, 4th Floor, Office No. 41, 402, 403, and 5th Floor off 502, Waris Heights, Pune - Satara Road, Dhankwadi, Pune",411030,9890927793,,,Charity,YES,18.466161,73.857642
M/s. Vidyashree Charitable Trusts Om Blood Bank,Maharashtra,PUNE,Pune,,,,,Charity,,0,0
District Civil Surgeon Blood Bank,Maharashtra,RAIGAD,"District Hospital Blood Bank, Civil Hospital Campus, Sea Face Road, Alibag  ",402201,9881671533,bloodbankalibag@gmail.com,,Government,YES,18.640782,72.871716
Kakasaheb Chitle Memorial Centre Sanchalit - Jankalyan Blood Bank,Maharashtra,RAIGAD,"C.S. No. 1651, Near Lokmanya Vyayamshala, Shiwaji Chowk, Mahad, Raigad",402301,9420047251,jkrp_mahad@redifmail.com,,Charity,NO,18.082736,73.42265
M.B. More Foundation Blood Bank,Maharashtra,RAIGAD,"Ghar. No. 412, 1st Floor, Mangaon, Morba Road, Opposite to Civil Hospital, Mangaon, Raigad
",431002,9421230000,,,Charity,NO,19.067134,73.066397
Advanced Centre for Treatment Reasearch and Education in Cancer,Maharashtra,RAIGAD,"Owe Village, Sector 22, Plot No. 2, Kharghar, Navi Mumbai ",410208,9594000503,transmed.dept@actrec.gov.in,,Government,YES,19.065019,73.064507
M/s. Navi Mumbai Blood Bank,Maharashtra,RAIGAD,"Navi Mumbai Blood Bank, Vishwanath Bhavan, C-87, Sector 12, Kharghar, Navi Mumbai",410 210,"09870653138, 09223300850",navimumbaibb@gmail.com,,Charity,YES,19.034045,73.029533
Shree Sai Blood Bank & Component,Maharashtra,RAIGAD,"103,104,105,1st Floor Tirthraj Building, Old Thana Naka Road, Near Taluka Police Station,  Old Panvel, Raigad",410206,9820344697,,,Charity,YES,18.99397,73.106561
Rotary Club New Panvel charitable Trust s Late Dr. B.V. Limaye Blood Bank,Maharashtra,RAIGAD,"Plot No-8, Sect.1, Khanda Colony, Mumbai Pune Road, New Panvel (W) ",410206,9870211554,rotarybloodbank.newpanvel@gmail.com,,Charity,YES,19.008249,73.108321
Civil Surgeon - General Hospital Blood Bank,Maharashtra,RATNAGIRI,"Civil Hospital, Ratnagiri",415612,7709268824,bloodbank.ghr123@gmail.com,,Government,YES,16.989126,73.298866
Shree Swami Samarth Blood Bank,Maharashtra,RATNAGIRI,"B.K.L.Walwalkar Hospital Diagnostic & Research Centre, Shree Kshetra Darvan, Chiplun, Ratnagiri",415606,9922728167,bloodbank@walawalkarhospital.com,,Charity,YES,17.399914,73.547448
Indian Red Cross Society Blood Bank,Maharashtra,RATNAGIRI,"Khareghat Road, Ratnagiri",415612,9730818228,redcrossratnagiri@rediffmail.com,,Charity,YES,17.019013,73.298977
Indian Red Cross Blood Bank,Maharashtra,RATNAGIRI,Ratnagiri,,,,,Charity,YES,0,0
Prakash Blood Bank & Blood Component Seperation Unit,Maharashtra,SANGLI,"Prakash Shikshan Mandal&#39;s Prakash Hospital & Research Centre, Islampur Sangli Road, Uran - Islampur, Tal -Walwa, Dist- Sangli (Ms)
",415409,"02342 661212, 02342 661224",,,Charity,YES,0,0
Padmabhushan Vasantdada Patil Government Hospital Blood Bank,Maharashtra,SANGLI,"Padmabhushan Vasantdada Patil Government Hospital , Blood Bank, Dr. Ambedkar Road, Sangli .                                         
",416416,"09011654102, 09890935611",sanglicivilbb@gmail.com,,Government,NO,16.852571,74.574678
Rajaram Bapu Blood Bank,Maharashtra,SANGLI,"Islampur C.S. No. 99/1, Near Islampur Spiral CT-Scan
Peth-Sangli Road
",415409,8275391940,rajarambapu.bloodbank@rediffmail.com,,Charity,YES,17.048399,74.251122
Vasantdada Patil Blood Bank and Haematology Research Centre,Maharashtra,SANGLI,"AIP - Miraj, Mirasaheb Shopping Complex,  Opposite to City Police Station, Miraj, Sangli",416410,9422614033,svpbb1984@rediffmail.com,,Charity,NO,16.82132,74.649492
Miraj Medical Centre - Wanless Hospital Blood Bank,Maharashtra,SANGLI,"Wanless Hospital Blood Bank, Medical Centre, Miraj",416410,9604542311,,http://www.whmmc.org,Charity,YES,16.832135,74.645472
Jeevan Rekha Charitable Trust Blood Bank,Maharashtra,SANGLI,"H. No. 329/E, Ward No. 5, 1st Floor, Umrani Road, A/p-jath, Sangli
",416416,9822112722,,,Charity,NO,17.049271,75.204853
Smt. Anila Kantilal Kothari Blood Bank & Department of Hemato Oncology,Maharashtra,SANGLI,"Dr. D. K. Gosavi Memorial, Shri Siddhivinayak Ganapati Cancer Hospital, Sangli - Miraj Road, Miraj",416410,989022105,cancermiraj@gmail.com,,Charity,YES,16.833879,74.635364
Bharati Vidyapeeth University Medical college And Hospital Blood Bank,Maharashtra,SANGLI,"A/p Wanlesswadi, Miraj 
",416414,,,,Charity,YES,16.841716,74.617969
Hindratna Prakashbapu Patil Blood Bank,Maharashtra,SANGLI,"2nd Floor, Siddhivinayak Commercial Complex Guest House, Miraj Road, Near Tata Petrol Pump, Sangli
",416416,"07038915977, 09225821258",hindratnabloodbank@gmail.com,,Charity,YES,16.8537,74.580099
Miraj Serological Institute Blood Bank,Maharashtra,SANGLI,"S. No.795/A1, Dr. Bhalchandra Patil Hospital,  Zaribag Budhgaonkar Mala, Near Gulabrao Patil Medical College, Miraj 
",416410,9420041490,msibloodbank@gmail.com,,Charity,YES,16.828931,74.639399
Akshay Blood Bank,Maharashtra,SANGLI,"Plot No. 1/7, Near Anand Nursing Home, 2nd Floor, Miraj Sangli Road,  Sangli",416410,"09403723536, 09890244339",abbmiraj@gmail.com,,Charity,YES,16.838026,74.651827
Indian Red Cross Society Blood Bank - Shirgaonkar Blood Bank,Maharashtra,SANGLI,"Opposite to Civil Hospital, Plot No. 49, City Survey No.601/7, Sangli",416416,9422662066,shirgaonkar_sangli@yahoo.co.in,,Charity,YES,16.853702,74.575077
Shree Basaveshwar Manav Vikas Gramin Sevabhavi Sanstha Blood Bank,Maharashtra,SANGLI,"Arihant Galaxy, 1st Floor, C.S. NO- 1599, Opposite to Civil Hospital, Garpir Road, Sangli
",416416,"09225812369, 09604520087, 07798539069",adarshbloodbank@gmail.com,,Charity,YES,16.842421,74.619929
Azad Panchi Group Charitable Trust Blood Bank,Maharashtra,SANGLI,"Near Civil Hospital, Ganesh Nagar, 1st Lane, S. No. 1682, Sangli
",416416,9423337545,msibloodbank@gmail.com,,Charity,YES,16.844539,74.572891
S. S. Venutai Y. Chavan Sub-District Hospital Blood Bank Karad,Maharashtra,SATARA,"Plot No. 290/91, Budhwar Peth Station Road, Karad, Satara",415110,993696968,mskarad@gmail.com,,Government,NO,17.288048,74.186177
Civil Surgeon - Sarva Samanya Hospital Blood Bank,Maharashtra,SATARA,"Bazar Road, Satara",415001,"09822115414, 09822637176",bbsknpsatara@gmail.com,,Government,NO,17.691305,74.009424
Phaltan Medical Foundation Blood Bank,Maharashtra,SATARA,"C.T.S. No. 5604/6, Near Dnyaneshwar Mandir, Behind State Bank of India, Laxminagar, 1st Floor Phaltan, Satara",415523,"09922642909, 09422400507",,,Charity,NO,17.992317,74.42537
Krishna Hospital and Medical Research Centre Blood Bank Karad,Maharashtra,SATARA,"Poona Bangalore (NH 4) Highway, Near Debhewadi Road, Karad, Satara",415110,9420463203,khbloodbank@yahoo.com,,Charity,YES,17.285065,74.185701
Instutute of Medical Science and Research Blood Bank and Blood Component Seperation Unit,Maharashtra,SATARA,"Shree Chatrapati Shivaji Education Societys, Instutute of Medical Science and Research Blood Bank and Blood Component Seperation Unit,  Vita Road, Vidyagiri, Mayani, Satatra",415102,9422463201,insrmyn05@rediffmail.com,,Private,YES,17.431214,74.549364
M/s. K. N. Gujar Blood Bank,Maharashtra,SATARA,"M/s K.N. Gujar Blood Bank, F. P. No. 21, 203/A/6, 1st Floor, K.N. Gujar Hospital, Shanivar Peth, Near S.T. Bus Stand, Karad, Satara",415110,9763999704,,,Charity,YES,17.278263,74.183727
M/s. Balaji Blood Bank,Maharashtra,SATARA,"M/s. MA. NA. Shri R.R. (AABA) Patil Shikshan Sheti Sanshodhan Aani Vikas Sansthas  Balaji Blood Bank, C.S.No - 467/8 A 1b/45, Jaldhara Building 2nd Floor, Sadar Bazar, Satara - 415002
",415002,9860022646,balajibbsatara@gmail.com,,Charity,YES,17.695093,74.010716
Akshay Blood Bank,Maharashtra,SATARA,"Akshay Medical Trust, Akshay Blood Bank, 506/22, Sadar Bazar, Near State Bank, Opposite to Nirmal Hotel, Satara",415002,9823165603 / 8484987322,abbSatara@gmail.com,,Charity,YES,17.672028,74.021087
Mauli Blood Bank Satara,Maharashtra,SATARA,"529/b,  Parasnis Colony, Near Hotel Monark, Powai Naka Sadar Bazar, Satara ",415001,9975639723,maulibloodbank@gmail.com,,Private,NO,17.686084,74.007955
Yashwantrao Chavan Blood Bank,Maharashtra,SATARA,"Phase 5, Super Market, 1st Floor Hall No. 2/1 Final Plot No. 432,433, Shaniwar Peth, Karad  ",415110,7028492699,ycbbkarad@gmail.com,,Charity,YES,17.275751,74.18181
Civil Surgeon - General Hospital Blood Bank,Maharashtra,SINDHUDURG,"Sindhudurg Oros, At Post - Oros, Kudal, Sindhudurga (Oros)",416812,"09422416949, 08007273138",orosbloodbank@gmail.com,,Government,YES,16.12019,73.689563
"Cottage Hospital Blood Bank, Sawantwadi",Maharashtra,SINDHUDURG,"Sub -District Cottage Hospital, Blood Bank, Sawantwadi
C-Sindhudurg",416510,9822308943,bloodbank.sdhsawantwadi@gmail.com,,Government,NO,15.902781,73.823544
Dean Chatrapati Shivaji Maharaj Sarvopchar Hospital Blood Bank,Maharashtra,SOLAPUR,"B-Block Ground Floor, Shri. Chatrapati Shivaji Maharaj Sarvopchar Hospital, Solapur, Maharashtra",413003,"09325593399, 09423068610","dr.g.a.pandit@gmail.com, bloodbanksolapur@gmail.com",,Government,NO,17.659024,75.912826
Shri Markendya Charitable and Medical Trust Irrapanna N Boli Blood Bank,Maharashtra,SOLAPUR,"Ashok Chowk, 896/97, Bhavnarishi Peth (Bolli Mangal Karayalaya 1 floor, Solapur",413006,9970916878,,,Charity,YES,17.659918,75.906391
"Dr. Hegdewar Rakta Pedhi Sanstha, Solapur",Maharashtra,SOLAPUR,"1st Floor, Sahyadri Shopping Centre Railway Lines, Solapur",413001,9423227552,hedgewar.raktapedhi@gmail.com,,Charity,YES,17.66391,75.900793
